,Quote,Author,Tags
666,Never allow someone to be your priority while allowing yourself to be their option.,Mark Twain,       heartbreak
667,"I was gratified to be able to answer promptly, and I did. I said I didn’t know.",Mark Twain,"       humor,       knowledge"
668,"My experience of life is that it is not divided up into genres; it’s a horrifying, romantic, tragic, comical, science-fiction cowboy detective novel. You know, with a bit of pornography if you're lucky.",Alan Moore,       life
669,Turn your wounds into wisdom.,Oprah Winfrey,"       experience,       inspirational,       pain,       wisdom,       wounds"
670,"When you're struggling with something, look at all the people around you and realize that every single person you see is struggling with something, and to them, it's just as hard as what you're going through.","Nicholas Sparks,",
671,Nothing that’s worthwhile is ever easy. Remember that.,"Nicholas Sparks,",
672,Happiness is a warm puppy.,Charles M. Schulz,"       animals,       dogs,       happiness,       humor,       puppies"
673,"Once on a yellow piece of paper with green lines	he wrote a poemAnd he called it ""Chops""	because that was the name of his dogAnd that's what it was all aboutAnd his teacher gave him an A	and a gold starAnd his mother hung it on the kitchen door	and read it to his auntsThat was the year Father Tracy	took all the kids to the zooAnd he let them sing on the busAnd his little sister was born	with tiny toenails and no hairAnd his mother and father kissed a lotAnd the girl around the corner sent him aValentine signed with a row of X's	and he had to ask his father what the X's meantAnd his father always tucked him in bed at nightAnd was always there to do itOnce on a piece of white paper with blue lines	he wrote a poemAnd he called it ""Autumn""	because that was the name of the seasonAnd that's what it was all aboutAnd his teacher gave him an A	and asked him to write more clearlyAnd his mother never hung it on the kitchen door	because of its new paintAnd the kids told him	that Father Tracy smoked cigarsAnd left butts on the pewsAnd sometimes they would burn holesThat was the year his sister got glasses	with thick lenses and black framesAnd the girl around the corner laughed	when he asked her to go see Santa ClausAnd the kids told him why	his mother and father kissed a lotAnd his father never tucked him in bed at nightAnd his father got mad	when he cried for him to do it.Once on a paper torn from his notebook	he wrote a poemAnd he called it ""Innocence: A Question""	because that was the question about his girlAnd that's what it was all aboutAnd his professor gave him an A	and a strange steady lookAnd his mother never hung it on the kitchen door	because he never showed herThat was the year that Father Tracy diedAnd he forgot how the end	of the Apostle's Creed wentAnd he caught his sister	making out on the back porchAnd his mother and father never kissed	or even talkedAnd the girl around the corner	wore too much makeupThat made him cough when he kissed her	but he kissed her anyway	because that was the thing to doAnd at three a.m. he tucked himself into bed	his father snoring soundlyThat's why on the back of a brown paper bag	he tried another poemAnd he called it ""Absolutely Nothing""Because that's what it was really all aboutAnd he gave himself an A	and a slash on each damned wristAnd he hung it on the bathroom door	because this time he didn't think	he could reach the kitchen.","Stephen Chbosky,",       poem
674,Books may well be the only true magic.,Alice Hoffman,       books
675,"No tears in the writer, no tears in the reader. No surprise in the writer, no surprise in the reader.",Robert Frost,"       reading,       writing"
676,War is peace. Freedom is slavery. Ignorance is strength.,"George Orwell,","       freedom,       ignorance,       inspirational,       war"
677,"You said you were going for a walk!? What kind of walk takes six hours?""""A long one?","Cassandra Clare,",       mortal-instruments
678,Deserves it! I daresay he does. Many that live deserve death. And some that die deserve life. Can you give it to them? Then do not be too eager to deal out death in judgement. For even the very wise cannot see all ends.,"J.R.R. Tolkien,","       compassion,       justice,       mercy"
679,Two possibilities exist: either we are alone in the Universe or we are not. Both are equally terrifying.,Arthur C. Clarke,"       distance,       life,       loneliness,       qotd,       sense-of-wonder,       universe"
680,"The important thing is not to stop questioning. Curiosity has its own reason for existence. One cannot help but be in awe when he contemplates the mysteries of eternity, of life, of the marvelous structure of reality. It is enough if one tries merely to comprehend a little of this mystery each day.—""Old Man's Advice to Youth: 'Never Lose a Holy Curiosity.'"" LIFE Magazine (2 May 1955) p. 64",Albert Einstein,"       1955,       curiosity,       mystery,       physics,       science"
681,"Each day means a new twenty-four hours. Each day means everything's possible again. You live in the moment, you die in the moment, you take it all one day at a time.","Marie Lu,",
682,"Life is too short to waste your time on people who don’t respect, appreciate, and value you.","Roy T. Bennett,","       appreciate,       inspiration,       inspirational,       inspirational-attitude"
683,"When you have eliminated all which is impossible, then whatever remains, however improbable, must be the truth.","Arthur Conan Doyle,",       inspirational
684,"Men occasionally stumble over the truth, but most of them pick themselves up and hurry off as if nothing had happened.",Winston S. Churchill,       truth
685,"I cannot fix on the hour, or the spot, or the look or the words, which laid the foundation. It is too long ago. I was in the middle before I knew that I had begun.","Jane Austen,","       love,       romance"
686,"You gain strength, courage and confidence by every experience in which you really stop to look fear in the face. You are able to say to yourself, 'I have lived through this horror. I can take the next thing that comes along.' You must do the thing you think you cannot do.","Eleanor Roosevelt,",       confidence
687,"Without pain, how could we know joy?' This is an old argument in the field of thinking about suffering and its stupidity and lack of sophistication could be plumbed for centuries but suffice it to say that the existence of broccoli does not, in any way, affect the taste of chocolate.","John Green,","       broccoli,       chocolate,       joy,       pleasures,       suffering"
688,"Kiss me, and you will see how important I am.","Sylvia Plath,","       importance,       kiss,       kissing"
689,"Don't ever tell anybody anything. If you do, you start missing everybody.",J. D. Salinger,"       salinger,       stories"
690,"Should I kill myself, or have a cup of coffee?",Albert Camus,       attributed-no-source
691,"Remember when you tried to convince me to feed a poultry pie to the mallards in the park to see if you could breed a race of cannibal ducks?"" ""They ate it too,"" Will reminisced. ""Bloodthirsty little beasts. Never trust a duck.","Cassandra Clare,","       jem-carstairs,       will-herondale"
692,I wonder how many people I've looked at all my life and never seen.,"John Steinbeck,",
693,"Many people, myself among them, feel better at the mere sight of a book.","Jane Smiley,","       books,       reading"
694,You cannot protect yourself from sadness without protecting yourself from happiness.,Jonathan Safran Foer,"       happiness,       sadness"
695,"Believe in yourself. You are braver than you think, more talented than you know, and capable of more than you imagine.","Roy T. Bennett,","       achievement,       believe-in-yourself,       brave,       courage,       inspiration,       inspirational,       inspirational-attitude,       inspirational-life,       inspirational-quotes,       inspire,       inspiring,       life,       life-and-living,       life-lessons,       life-quotes,       living,       motivation,       motivational,       optimism,       optimistic,       positive,       positive-affirmation,       positive-life,       positive-thinking,       talent"
696,"Fantasy is a necessary ingredient in living, it's a way of looking at life through the wrong end of a telescope.",Dr. Seuss,"       fantasy,       humor"
697,"Painting is poetry that is seen rather than felt, and poetry is painting that is felt rather than seen.",Leonardo da Vinci,"       art,       poetry"
698,"Religion has actually convinced people that there's an invisible man living in the sky who watches everything you do, every minute of every day. And the invisible man has a special list of ten things he does not want you to do. And if you do any of these ten things, he has a special place, full of fire and smoke and burning and torture and anguish, where he will send you to live and suffer and burn and choke and scream and cry forever and ever 'til the end of time! But He loves you. He loves you, and He needs money! He always needs money! He's all-powerful, all-perfect, all-knowing, and all-wise, somehow just can't handle money!",George Carlin,"       atheism,       humor,       life,       religion"
699,"I don't know the question, but sex is definitely the answer.",Woody Allen,"       humor,       life,       sex"
700,You must have chaos within you to give birth to a dancing star.,Friedrich Nietzsche,"       art,       chaos"
701,"It is said that your life flashes before your eyes just before you die. That is true, it's called Life.","Terry Pratchett,","       death,       humor,       life"
702,"Everyone sees what you appear to be, few experience what you really are.","Niccolò Machiavelli,",
703,"Above all, be the heroine of your life, not the victim.",Nora Ephron,"       courage,       empowerment,       self-determination,       women"
704,There comes a time when the world gets quiet and the only thing left is your own heart. So you'd better learn the sound of it. Otherwise you'll never understand what it's saying.,"Sarah Dessen,","       just-litsen,       sarah-dessen,       time"
705,Stop acting so small. You are the universe in ecstatic motion.,Rumi,
706,"Life is a disease: sexually transmitted, and invariably fatal.",Neil Gaiman,
707,Live the Life of Your Dreams: Be brave enough to live the life of your dreams according to your vision and purpose instead of the expectations and opinions of others.,"Roy T. Bennett,","       brave,       courage,       dreams,       inspiration,       inspirational,       inspirational-attitude,       inspirational-life,       inspirational-quotes,       inspire,       inspiring,       life,       life-and-living,       life-lessons,       life-quotes,       living,       motivation,       motivational,       optimism,       optimistic,       positive,       positive-affirmation,       positive-life,       positive-thinking,       purpose,       vision"
708,"The simple things are also the most extraordinary things, and only the wise can see them.","Paulo Coelho,",       wisdom
709,"I am very interested and fascinated how everyone loves each other, but no one really likes each other.","Stephen Chbosky,",       moi
710,"You have your way. I have my way. As for the right way, the correct way, and the only way, it does not exist.",Friedrich Wilhelm Nietzsche,"       amorality,       correct-way,       individuality,       my-way,       only-way,       right-way,       the-way,       your-way"
711,"But luxury has never appealed to me, I like simple things, books, being alone, or with somebody who understands.",Daphne du Maurier,
712,"You're still trying to protect me. Real or not real,"" he whispers.""Real,"" I answer. ""Because that's what you and I do, protect each other.","Suzanne Collins,","       hunger-games,       katniss,       peeta"
713,Why fit in when you were born to stand out?,Dr. Seuss,       seuss
714,"What happens when people open their hearts?""""They get better.","Haruki Murakami,","       healing,       vulnerability"
715,Whatever it is you're seeking won't come in the form you're expecting.,Haruki Marukami,       expectation
716,That's the thing about books. They let you travel without moving your feet.,"Jhumpa Lahiri,",       books
717,To be nobody but yourself in a world which is doing its best day and night to make you like everybody else means to fight the hardest battle which any human being can fight and never stop fighting.,E.E. Cummings,       poetry
718,There are worse crimes than burning books. One of them is not reading them.,Joseph Brodsky,"       books,       censorship,       illiteracy,       reading"
719,"It may be unfair, but what happens in a few days, sometimes even a single day, can change the course of a whole lifetime...","Khaled Hosseini,","       fair,       life"
720,What matters in life is not what happens to you but what you remember and how you remember it.,Gabriel Garcia Marquez,       life-memories
721,"That is part of the beauty of all literature. You discover that your longings are universal longings, that you're not lonely and isolated from anyone. You belong.",F. Scott Fitzgerald,"       belonging,       company,       desires,       literature,       longings"
722,"Many boys will bring you flowers. But someday you'll meet a boy who will learn your favorite flower, your favorite song, your favorite sweet. And even if he is too poor to give you any of them, it won't matter because he will have taken the time to know you as no one else does. Only that boy earns your heart.","Leigh Bardugo,","       leigh-bardugo,       six-of-crows"
723,You must stay drunk on writing so reality cannot destroy you.,"Ray Bradbury,",       writing
724,"Everyone should be able to do one card trick, tell two jokes, and recite three poems, in case they are ever trapped in an elevator.","Lemony Snicket,",       funny
725,"To douchebags!"" he said, gesturing to Brad. ""And to girls that break your heart,"" he bowed his head to me. His eyes lost focus. ""And to the absolute fucking horror of losing your best friend because you were stupid enough to fall in love with her.","Jamie McGuire,","       best-friends,       heartbreak,       love"
726,Remember: the time you feel lonely is the time you most need to be by yourself. Life's cruelest irony.,"Douglas Coupland,","       irony,       life,       loneliness"
727,"Love doesn't just sit there, like a stone, it has to be made, like bread; remade all the time, made new.","Ursula K. Le Guin,",       love
728,"If you have a garden and a library, you have everything you need.",Cicero,       books
729,I have great faith in fools - self-confidence my friends will call it.,"Edgar Allan Poe,","       faith,       fool,       humor,       self-confidence,       self-irony"
730,"People are afraid of themselves, of their own reality; their feelings most of all. People talk about how great love is, but that’s bullshit. Love hurts. Feelings are disturbing. People are taught that pain is evil and dangerous. How can they deal with love if they’re afraid to feel? Pain is meant to wake us up. People try to hide their pain. But they’re wrong. Pain is something to carry, like a radio. You feel your strength in the experience of pain. It’s all in how you carry it. That’s what matters. Pain is a feeling. Your feelings are a part of you. Your own reality. If you feel ashamed of them, and hide them, you’re letting society destroy your reality. You should stand up for your right to feel your pain.",Jim Morrison,"       jim,       life,       morrison,       pain,       reality"
731,Stories of imagination tend to upset those without one.,Terry Pratchett,"       fantasy,       humor,       imagination,       literature,       stories"
732,You have to die a few times before you can reallylive.,"Charles Bukowski,",
733,"Imagine yourself as a living house. God comes in to rebuild that house. At first, perhaps, you can understand what He is doing. He is getting the drains right and stopping the leaks in the roof and so on; you knew that those jobs needed doing and so you are not surprised. But presently He starts knocking the house about in a way that hurts abominably and does not seem to make any sense. What on earth is He up to? The explanation is that He is building quite a different house from the one you thought of - throwing out a new wing here, putting on an extra floor there, running up towers, making courtyards. You thought you were being made into a decent little cottage: but He is building a palace. He intends to come and live in it Himself.","C.S. Lewis,",       god-religion-house
734,If you're looking for sympathy you'll find it between shit and syphilis in the dictionary.,"David Sedaris,",       sympathy
735,Stupid people are dangerous.,"Suzanne Collins,",
736,Prayer is not asking. It is a longing of the soul. It is daily admission of one's weakness. It is better in prayer to have a heart without words than words without a heart.,Mahatma Gandhi,"       god,       heart,       humanity,       inspirational,       prayer,       religion,       souls,       weakness"
737,"A WOMAN SHOULD HAVE .... enough money within her control to move out and rent a place of her own even if she never wants to or needs to... A WOMAN SHOULD HAVE .... something perfect to wear if the employer or date of her dreams wants to see her in an hour... A WOMAN SHOULD HAVE ... a youth she's content to leave behind.... A WOMAN SHOULD HAVE .... a past juicy enough that she's looking forward to retelling it in her old age.... A WOMAN SHOULD HAVE ..... a set of screwdrivers, a cordless drill, and a black lace bra... A WOMAN SHOULD HAVE .... one friend who always makes her laugh... and one who lets her cry... A WOMAN SHOULD HAVE .... a good piece of furniture not previously owned by anyone else in her family... A WOMAN SHOULD HAVE .... eight matching plates, wine glasses with stems, and a recipe for a meal that will make her guests feel honored... A WOMAN SHOULD HAVE .... a feeling of control over her destiny... EVERY WOMAN SHOULD KNOW... how to fall in love without losing herself.. EVERY WOMAN SHOULD KNOW... HOW TO QUIT A JOB, BREAK UP WITH A LOVER, AND CONFRONT A FRIEND WITHOUT RUINING THE FRIENDSHIP... EVERY WOMAN SHOULD KNOW... when to try harder... and WHEN TO WALK AWAY... EVERY WOMAN SHOULD KNOW... that she can't change the length of her calves, the width of her hips, or the nature of her parents.. EVERY WOMAN SHOULD KNOW... that her childhood may not have been perfect...but it's over... EVERY WOMAN SHOULD KNOW... what she would and wouldn't do for love or more... EVERY WOMAN SHOULD KNOW... how to live alone... even if she doesn't like it... EVERY WOMAN SHOULD KNOW... whom she can trust, whom she can't, and why she shouldn't take it personally... EVERY WOMAN SHOULD KNOW... where to go... be it to her best friend's kitchen table... or a charming inn in the woods... when her soul needs soothing... EVERY WOMAN SHOULD KNOW... what she can and can't accomplish in a day... a month...and a year...",Pamela Redmond Satran,
738,"One day, in retrospect, the years of struggle will strike you as the most beautiful.",Sigmund Freud,       inspirational-quotes
739,I lie to myself all the time. But I never believe me.,"S.E. Hinton,","       lies,       lying,       self-deception,       truth"
740,"I have found the paradox, that if you love until it hurts, there can be no more hurt, only more love.","Daphne Rae,",       misattributed-to-mother-teresa
741,"Man may have discovered fire, but women discovered how to play with it.","Candace Bushnell,","       love,       relationships"
742,"Some tourists think Amsterdam is a city of sin, but in truth it is a city of freedom. And in freedom, most people find sin.","John Green,","       amsterdam,       freedom,       sin"
743,"That does it,"" said Jace. ""I'm going to get you a dictionary for Christmas this year.""""Why?"" Isabelle said.""So you can look up 'fun.' I'm not sure you know what it means.","Cassandra Clare,","       dictionary,       fun,       humor,       isabelle-lightwood,       jace-wayland"
744,Laughter is timeless. Imagination has no age. And dreams are forever.,Walt Disney,
745,They love their hair because they're not smart enough to love something more interesting.,"John Green,","       awesomeness,       funny"
746,My ambition is handicapped by laziness,"Charles Bukowski,",
747,"The problem with the world is that the intelligent people are full of doubts, while the stupid ones are full of confidence.",Charles Bukowski,
748,"I think God, in creating man, somewhat overestimated his ability.",Oscar Wilde,"       creation,       god,       humor,       man"
749,Education is the most powerful weapon which you can use to change the world.,Nelson Mandela,"       change,       education"
750,"Books are my friends, my companions. They make me laugh and cry and find meaning in life.","Christopher Paolini,","       books,       christopher-paolini,       eragon,       good-reads"
751,"I have never listened to anyone who criticized my taste in space travel, sideshows or gorillas. When this occurs, I pack up my dinosaurs and leave the room.","Ray Bradbury,","       humour,       individuality,       science-fiction"
752,"As usual, there is a great woman behind every idiot.",John Lennon,"       beatles,       men,       women"
753,"Don’t waste your time in anger, regrets, worries, and grudges. Life is too short to be unhappy.",Roy T. Bennett,"       anger,       grudge,       happiness,       happy,       inspiration,       inspirational,       inspirational-quotes,       inspire,       inspiring,       life,       life-quotes,       living,       optimism,       optimistic,       positive,       positive-affirmation,       positive-life,       positive-thinking,       regret,       time,       worry"
754,"If you are going through hell, keep going.",Winston S. Churchill,"       hell,       perseverance"
755,Beneath the makeup and behind the smile I am just a girl who wishes for the world.,Marilyn Monroe,"       attributed-no-source,       girl,       makeup,       world"
756,"But I don’t want to go among mad people,"" Alice remarked.""Oh, you can’t help that,"" said the Cat: ""we’re all mad here. I’m mad. You’re mad.""""How do you know I’m mad?"" said Alice.""You must be,"" said the Cat, ""or you wouldn’t have come here.","Lewis Carroll,",       alice-s-adventures-in-wonderland
757,I don't go looking for trouble. Trouble usually finds me.,"Katie McGarry,",       trouble
758,"But who prays for Satan? Who, in eighteen centuries, has had the common humanity to pray for the one sinner that needed it most?",Mark Twain,       humor-satan
759,Nothing of me is original. I am the combined effort of everyone I've ever known.,"Chuck Palahniuk,","       identity,       originality"
760,It isn't what you have or who you are or where you are or what you are doing that makes you happy or unhappy. It is what you think about it.,"Dale Carnegie,","       attitude,       contentment,       happiness,       inspirational,       life"
761,Time flies like an arrow; fruit flies like a banana.,Anthony G. Oettinger,"       humor,       misattributed-to-groucho-marx,       time"
762,"Life is pain, highness. Anyone who says differently is selling something.","William Goldman,","       life,       pain"
763,"What I need is the dandelion in the spring. The bright yellow that means rebirth instead of destruction. The promise that life can go on, no matter how bad our losses. That it can be good again.","Suzanne Collins,","       inspirational,       love"
764,Being crazy isn't enough.,Dr. Seuss,       crazy
765,"I like your Christ, I do not like your Christians. Your Christians are so unlike your Christ.",Mahatma Gandhi,"       anti-christian,       christianity,       christians,       jesus-christ"
766,"Never be afraid to raise your voice for honesty and truth and compassion against injustice and lying and greed. If people all over the world...would do this, it would change the earth.",William Faulkner,"       advocacy,       dissent,       protest,       truth,       truth-telling"
767,The difference between the almost right word and the right word is really a large matter. ’tis the difference between the lightning bug and the lightning.,"Mark Twain,",       writing
768,"I don't trust people who don't love themselves and tell me, 'I love you.' ... There is an African saying which is: Be careful when a naked person offers you a shirt.",Maya Angelou,"       1997,       annie-clark-tanner-lecture,       inspirational,       love,       trust"
769,Deadlines just aren't real to me until I'm staring one in the face.,"Rick Riordan,","       deadlines,       humor,       procrastinate"
770,"If you love somebody, let them go, for if they return, they were always yours. If they don't, they never were.",Kahlil Gibran,"       life,       love,       romance"
771,I never travel without my diary. One should always have something sensational to read in the train.,"Oscar Wilde,","       drama,       humor,       plays"
772,"There are three things all wise men fear: the sea in storm, a night with no moon, and the anger of a gentle man.","Patrick Rothfuss,","       fear,       name-of-the-wind,       patrick-rothfuss,       wisdom"
773,"What I want is to be needed. What I need is to be indispensable to somebody. Who I need is somebody that will eat up all my free time, my ego, my attention. Somebody addicted to me. A mutual addiction.","Chuck Palahniuk,",       love
