,Quote,Author,Tags
2217,"Even in half demon hunter clothes, Clary thought, he looked like the kind of boy who'd come over your house to pick you up for a date and be polite to your parents and nice to your pets.Jace on the other hand, looked like the kind of boy who'd come over your house and burn it down just for kicks.","Cassandra Clare,","       clary-fray,       jace-wayland,       shadowhunters,       simon"
2218,"Sometimes, I feel the past and the future pressing so hard on either side that there's no room for the present at all.","Evelyn Waugh,",
2219,There must be those among whom we can sit down and weep and still be counted as warriors.,Adrienne Rich,       inspirational
2220,You can make anything by writing.,C.S. Lewis,       writing
2221,"As a woman I have no country. As a woman I want no country. As a woman, my country is the whole world.",Virginia Woolf,       women
2222,I like flaws. I think they make things interesting.,"Sarah Dessen,","       life,       love"
2223,I like it when somebody gets excited about something. It's nice.,"J.D. Salinger,",
2224,I think that we're all mentally ill. Those of us outside the asylums only hide it a little better - and maybe not all that much better after all.,Stephen King,
2225,A library is infinity under a roof.,Gail Carson Levine,
2226,There is a crack in everything.That's how the light gets in.,"Leonard Cohen,","       hope,       light"
2227,"Don't give in to your fears. If you do, you won't be able to talk to your heart.","Paulo Coelho,",       fear
2228,"Make your mistakes, take your chances, look silly, but keep on going. Don’t freeze up.","Thomas Wolfe,",
2229,"1. Be Impeccable With Your WordSpeak with integrity. Say only what you mean. Avoid using the word to speak against yourself or to gossip about others. Use the power of your word in the direction of truth and love. 2. Don't Take Anything PersonallyNothing others do is because of you. What others say and do is a projection of their own reality, their own dream. When you are immune to the opinions and actions of others, you won't be the victim of needless suffering. 3. Don't Make AssumptionsFind the courage to ask questions and to express what you really want. Communicate with others as clearly as you can to avoid misunderstandings, sadness and drama. With just this one agreement, you can completely transform your life. 4. Always Do Your BestYour best is going to change from moment to moment; it will be different when you are healthy as opposed to sick. Under any circumstance, simply do your best, and you will avoid self-judgment, self-abuse and regret.",Don Miguel Ruiz,"       spirituality,       toltec-wisdom"
2230,The brick walls are there for a reason. The brick walls are not there to keep us out. The brick walls are there to give us a chance to show how badly we want something. Because the brick walls are there to stop the people who don’t want it badly enough. They’re there to stop the other people.,"Randy Pausch,","       barriers,       challenges,       failure,       failures,       inspirational,       perseverance"
2231,This was another of our fears: that Life wouldn't turn out to be like Literature.,"Julian Barnes,",
2232,Thinking something does not make it true. Wanting something does not make it real.,"Michelle Hodkin,","       inspirational-quotes,       mara-dyer,       reality,       truth"
2233,Black holes are where God divided by zero.,Albert Einstein,       humor
2234,"Do not let the memories of your past limit the potential of your future. There are no limits to what you can achieve on your journey through life, except in your mind.","Roy T. Bennett,","       future,       inspiration,       inspirational,       inspirational-attitude,       inspirational-life,       inspirational-quotes,       inspire,       inspiring,       life,       life-and-living,       life-lessons,       life-quotes,       limit,       living,       motivation,       motivational,       optimism,       optimistic,       positive,       positive-affirmation,       positive-life,       positive-thinking,       potential"
2235,"I've lived through some terrible things in my life, some of which actually happened.",Mark Twain,       humor
2236,"When one tugs at a single thing in nature, he finds it attached to the rest of the world.",John Muir,       inspirational
2237,You're a painter. You're a baker. You like to sleep with the windows open. You never take sugar in your tea. And you always double-knot your shoelaces.,"Suzanne Collins,","       katniss-everdeen,       peeta-mellark"
2238,"please believe that things are good with me, and even when they're not, they will be soon enough. And i will always believe the same about you.","Stephen Chbosky,","       happiness,       inspirational,       life"
2239,"When you laugh, laugh like hell. And when you get angry, get good and angry. Try to be alive. You will be dead soon enough.",William Saroyan,
2240,Burdens are for shoulders strong enough to carry them.,"Margaret Mitchell,",
2241,"When everything goes to hell, the people who stand by you without flinching -- they are your family. ",Jim Butcher,       family
2242,"Stop comparing yourself to other people, just choose to be happy and live your own life.","Roy T. Bennett,","       happiness,       inspiration,       inspirational,       inspirational-attitude,       inspirational-life,       inspirational-quotes,       inspire,       inspiring,       life,       life-and-living,       life-lessons,       life-quotes,       living,       optimism,       optimistic,       positive,       positive-affirmation,       positive-life,       positive-thinking"
2243,"I hope that in this year to come, you make mistakes.Because if you are making mistakes, then you are making new things, trying new things, learning, living, pushing yourself, changing yourself, changing your world. You're doing things you've never done before, and more importantly, you're Doing Something.So that's my wish for you, and all of us, and my wish for myself. Make New Mistakes. Make glorious, amazing mistakes. Make mistakes nobody's ever made before. Don't freeze, don't stop, don't worry that it isn't good enough, or it isn't perfect, whatever it is: art, or love, or work or family or life.Whatever it is you're scared of doing, Do it.Make your mistakes, next year and forever.",Neil Gaiman,"       2012,       blog,       new-year"
2244,"Remember if people talk behind your back, it only means you are two steps ahead.","Fannie Flagg,",
2245,A woman's heart should be so hidden in God that a man has to seek Him just to find her.,Maya Angelou,       inspirational
2246,"Those who can make you believe absurdities, can make you commit atrocities.",Voltaire,"       absurdities,       atheism,       atrocities,       barbarity,       injustice,       religion,       skepticism"
2247,"May it be a light to you in dark places, when all other lights go out.","J.R.R. Tolkien,","       benediction,       gift,       light"
2248,"Grown-ups don't look like grown-ups on the inside either. Outside, they're big and thoughtless and they always know what they're doing. Inside, they look just like they always have. Like they did when they were your age. Truth is, there aren't any grown-ups. Not one, in the whole wide world.","Neil Gaiman,",
2249,The most effective way to destroy people is to deny and obliterate their own understanding of their history.,George Orwell,"       history,       propaganda,       rewriting-history"
2250,If I’m honest I have to tell you I still read fairy-tales and I like them best of all.,Audrey Hepburn,       fairy-tales
2251,No book can be appreciated until it has been slept with and dreamed over.,Eugene Field,
2252,"Selfishness is not living as one wishes to live, it is asking others to live as one wishes to live.",Oscar Wilde,       selfishness
2253,الكراهية تكلف أكثر من الحب.. لأنها إحساس غير طبيعي.. إحساس عكسي مثل حركة الأجسام ضد جاذبية الأرض.. تحتاج إلى قوة إضافية وتستهلك وقوداً أكثر,"مصطفى محمود,",
2254,"No matter how careful you are, there's going to be the sense you missed something, the collapsed feeling under your skin that you didn't experience it all. There's that fallen heart feeling that you rushed right through the moments where you should've been paying attention.Well, get used to that feeling. That's how your whole life will feel some day.This is all practice.","Chuck Palahniuk,",       life
2255,"Some people have a way with words, and other people...oh, uh, not have way.",Steve Martin,"       humor,       words"
2256,"I am too intelligent, too demanding, and too resourceful for anyone to be able to take charge of me entirely. No one knows me or loves me completely. I have only myself",Simone de Beauvoir,       feminism
2257,"I must be a mermaid, Rango. I have no fear of depths and a great fear of shallow living.",Anais Nin,"       anais-nin,       inspirational,       living,       mermaids,       no-fear,       sea"
2258,"If you have a sister and she dies, do you stop saying you have one? Or are you always a sister, even when the other half of the equation is gone?","Jodi Picoult,","       death,       loss,       sisters"
2259,"I have for the first time found what I can truly love–I have found you. You are my sympathy–my better self–my good angel–I am bound to you with a strong attachment. I think you good, gifted, lovely: a fervent, a solemn passion is conceived in my heart; it leans to you, draws you to my centre and spring of life, wrap my existence about you–and, kindling in pure, powerful flame, fuses you and me in one.","Charlotte Bronte,",
2260,"It is a far, far better thing that I do, than I have ever done; it is a far, far better rest that I go to than I have ever known.","Charles Dickens,","       last-words,       self-sacrifice"
2261,"You know, Hobbes, some days even my lucky rocket ship underpants don't help.",Bill Watterson,"       bad-day,       calvin-and-hobbes,       luck"
2262,"Never be bullied into silence. Never allow yourself to be made a victim. Accept no one's definition of your life, but define yourself.",Harvey Fierstein,"       be-yourself,       identity,       individuality,       inspirational,       life,       self-determination,       self-esteem,       self-expression"
2263,"Most of all, I hate you because I think of you. Often. It's disgusting, and I can't stop.","Holly Black,","       cardan,       jude,       lust,       the-cruel-prince"
2264,The best way to find yourself is to lose yourself in the service of others.,Mahatma Gandhi,"       attributed-no-source,       discovery,       identity,       self-discovery,       service"
2265,"But in a solitary life, there are rare moments when another soul dips near yours, as stars once a year brush the earth. Such a constellation was he to me.","Madeline Miller,","       circe,       constellations,       daedalus,       greek-mythology,       love,       stars"
2266,"Life is not a matter of holding good cards, but of playing a poor hand well.",Robert Louis Stevenson,       life
2267,"Behind every beautiful thing, there's some kind of pain.",Bob Dylan,"       beautiful,       behind,       kind,       of,       pain,       thing"
2268,"When one is in love, one always begins by deceiving one's self, and one always ends by deceiving others. That is what the world calls a romance.","Oscar Wilde,",       romance
2269,"Ginny!"" said Mr. Weasley, flabbergasted. ""Haven't I taught you anything? What have I always told you? Never trust anything that can think for itself if you can't see where it keeps its brain?","J.K. Rowling,","       humor,       trust"
2270,Being a writer is a very peculiar sort of a job: it's always you versus a blank sheet of paper (or a blank screen) and quite often the blank piece of paper wins.,Neil Gaiman,       writing
2271,No one ever told me that grief felt so like fear.,"C.S. Lewis,","       fear,       grief,       sorrow"
2272,"Freeing yourself was one thing, claiming ownership of that freed self was another.","Toni Morrison,","       freedom,       self"
2273,"If I had my life to live over again, I would have made a rule to read some poetry and listen to some music at least once every week.","Charles Darwin,","       arts,       life,       music,       poetry"
2274,Man only likes to count his troubles; he doesn't calculate his happiness.,"Fyodor Dostoevsky,","       happiness,       man,       trouble"
2275,"He needed to tell her...what? That she was lovely and brave and better than anything he deserved. That he was twisted, crooked, wrong, but not so broken that he couldn't pull himself together into some semblance of a man for her. That without meaning to, he'd begun to lean on her, to look for her, to need her near. He needed to thank her for his new hat.","Leigh Bardugo,","       leigh-bardugo,       six-of-crows"
2276,"When the snows fall and the white winds blow, the lone wolf dies but the pack survives.","George R.R. Martin,","       friendship,       loneliness"
2277,"You are not special. You're not a beautiful and unique snowflake. You're the same decaying organic matter as everything else. We're all part of the same compost heap. We're all singing, all dancing crap of the world.","Chuck Palahniuk,",       unique
2278,"The world was collapsing, and the only thing that really mattered to me was that she was alive.","Rick Riordan,","       infatuation,       love,       obsession"
2279,It's the job that's never started as takes longest to finish.,"J.R.R. Tolkien,","       fellowship,       gamgee,       hobbit,       samwise,       tolkien"
2280,The emotion that can break your heart is sometimes the very one that heals it...,"Nicholas Sparks,","       at-first-sight,       emotions,       healing,       heartbreak,       love,       nicholas,       nicholas-sparks,       sparks"
2281,"I will love you always. When this red hair is white, I will still love you. When the smooth softness of youth is replaced by the delicate softness of age, I will still want to touch your skin. When your face is full of the lines of every smile you have ever smiled, of every surprise I have seen flash through your eyes, when every tear you have ever cried has left its mark upon your face,I will treasure you all the more, because I was there to see it all. I will share your life with you, Meredith, and I will love you until the last breath leaves your body or mine.","Laurell K. Hamilton,","       inspirational,       love,       relationships"
2282,"Forbidden to remember, terrified to forget; it was a hard line to walk.","Stephenie Meyer,",       memory
2283,"Can you understand? Someone, somewhere, can you understand me a little, love me a little? For all my despair, for all my ideals, for all that - I love life. But it is hard, and I have so much - so very much to learn.","Sylvia Plath,",
2284,Remembering that you are going to die is the best way I know to avoid the trap of thinking you have something to lose. You are already naked. There is no reason not to follow your heart.,Steve Jobs,
2285,"Let the first act of every morning be to make the following resolve for the day:- I shall not fear anyone on Earth. - I shall fear only God. - I shall not bear ill will toward anyone. - I shall not submit to injustice from anyone. - I shall conquer untruth by truth. And in resisting untruth, I shall put up with all suffering.",Mahatma Gandhi,"       bravery,       god,       goodness,       humanity,       justice,       kindness,       peace,       suffering"
2286,Books have to be heavy because the whole world's inside them.,"Cornelia Funke,",       inkheart
2287,"My alone feels so good, I'll only have you if you're sweeter than my solitude.",Warsan Shire,
2288,The only thing necessary for the triumph of evil is for good men to do nothing.,Edmund Burke,       evil
2289,"They always say time changes things, but you actually have to change them yourself.","Andy Warhol,","       change,       initiative,       time"
2290,"Jace shook his blond head in exasperation. ""You had to make a crazy jail friend, didn't you? You couldn't just count ceiling tiles or tame a pet mouse like normal prisoners do?","Cassandra Clare,","       humor,       jace"
2291,You are not rich until you have a rich heart.,"Roy T. Bennett,","       heart,       inspiration,       inspirational,       inspirational-quotes,       inspire,       inspiring,       life,       life-quotes,       living,       optimism,       optimistic,       positive,       positive-affirmation,       positive-life,       positive-thinking,       rich,       rich-heart,       richness"
2292,"When I saw you I fell in love, and you smiled because you knew.",Arrigo Boito,       love
2293,People change and forget to tell each other.,Lillian Hellman,
2294,"I fell in love with her when we were together, then fell deeper in love with her in the years we were apart.","Nicholas Sparks,","       love,       separation"
2295,The truth will set you free. But not until it is finished with you.,"David Foster Wallace,","       freedom,       truth"
2296,"I am only responsible for my own heart, you offered yours up for the smashing my darling. Only a fool would give out such a vital organ",Anais Nin,
2297,"Things need not have happened to be true. Tales and dreams are the shadow-truths that will endure when mere facts are dust and ashes, and forgot.","Neil Gaiman,",       sandman
2298,Better to die fighting for freedom then be a prisoner all the days of your life.,Bob Marley,"       freedom,       liberty,       life,       revolution"
2299,"I am not proud, but I am happy; and happiness blinds, I think, more than pride.","Alexandre Dumas,","       happiness,       pride"
2300,"Heaven knows we need never be ashamed of our tears, for they are rain upon the blinding dust of earth, overlying our hard hearts. I was better after I had cried, than before--more sorry, more aware of my own ingratitude, more gentle.","Charles Dickens,","       crying,       heartfelt,       shame,       sorrow,       tears"
2301,"I could die for you. But I couldn't, and wouldn't, live for you.","Ayn Rand,","       death,       die,       fountainhead,       life,       live,       mortality"
2302,You like someone who can't like you back because unrequited love can be survived in a way that once-requited love cannot. ,"John Green,",
2303,"The ultimate measure of a man is not where he stands in moments of comfort and convenience, but where he stands at times of challenge and controversy.",Martin Luther King Jr.,       challanges
2304,It must require bravery to be honest all the time.,"Veronica Roth,",
2305,"That's the thing about depression: A human being can survive almost anything, as long as she sees the end in sight. But depression is so insidious, and it compounds daily, that it's impossible to ever see the end.","Elizabeth Wurtzel,",       depression
2306,"Even the strongest and bravest must sometimes weep. It shows they have a great heart, one that can feel compassion for others.","Brian Jacques,",
2307,The supreme art of war is to subdue the enemy without fighting.,"Sun Tzu,","       diplomacy,       strategy,       victory,       war"
2308,"The more one judges, the less one loves.","Honoré de Balzac,","       human-nature,       love"
2309,"When we don't know who to hate, we hate ourselves.","Chuck Palahniuk,","       hate,       self-loathing"
2310,"It ain't what they call you, it's what you answer to.",W.C. Fields,"       labels,       names"
2311,One person's craziness is another person's reality.,Tim Burton,"       craziness,       insanity,       perspective,       reality,       sanity"
2312,"What happened down in the dungeons between you and Professor Quirrell is a complete secret, so, naturally the whole school knows.","J. K. Rowling,",       dumbledore
2313,"If you have enough book space, I don't want to talk to you.",Terry Pratchett,"       books,       shelves"
2314,"When the first baby laughed for the first time, its laugh broke into a thousand pieces, and they all went skipping about, and that was the beginning of fairies.","J.M. Barrie,",       happiness
2315,Let the improvement of yourself keep you so busy that you have no time to criticize others.,"Roy T. Bennett,","       improvement,       inspiration,       inspirational,       inspirational-attitude,       inspirational-life,       inspirational-quotes,       inspire,       inspiring,       leadership,       learning,       life,       life-and-living,       life-lessons,       life-quotes,       living,       motivation,       motivational,       optimism,       optimistic,       positive,       positive-affirmation,       positive-life,       positive-thinking,       success"
2316,I don't like people who have never fallen or stumbled. Their virtue is lifeless and it isn't of much value. Life hasn't revealed its beauty to them. ,Boris Pasternak,       life
2317,If you're too open-minded; your brains will fall out.,Lawrence Ferlinghetti,"       beatnik,       cynical,       funny,       humour"
2318,"Stories can conquer fear, you know. They can make the heart bigger.",Ben Okri,       stories
2319,"A friend said to me, Hey you need to grow a pair. Grow a pair, Bro. It’s when someone calls you weak, but they associate it with a lack of testicles. Which is weird, because testicles are the most sensitive things in the world. If you suddenly just grew a pair, you’d be a lot more vulnerable. If you want to be tough, you should lose a pair. If you want to be real tough, you should grow a vagina. Those things can take a pounding.",Sheng Wang,"       feminism,       humor,       misattributed-betty-white"
2320,"I am lonely, yet not everybody will do. I don't know why, some people fill the gaps and others emphasize my loneliness. In reality those who satisfy me are those who simply allow me to live with my ''idea of them.",Anais Nin,       diary-entry
2321,Try to be a rainbow in someone's cloud.,"Maya Angelou,","       2008,       advice"
2322,"No sight so sad as that of a naughty child,"" he began, ""especially a naughty little girl. Do you know where the wicked go after death?""""They go to hell,"" was my ready and orthodox answer.""And what is hell? Can you tell me that?""""A pit full of fire.""""And should you like to fall into that pit, and to be burning there for ever?""""No, sir.""""What must you do to avoid it?""I deliberated a moment: my answer, when it did come was objectionable: ""I must keep in good health and not die.","Charlotte Brontë,","       children,       hell,       humor,       religion"
2323,"I learned that courage was not the absence of fear, but the triumph over it. The brave man is not he who does not feel afraid, but he who conquers that fear.",Nelson Mandela,"       bravery,       courage,       fear"
2324,It is never too late to be wise.,"Daniel Defoe,",
2325,Better a cruel truth than a comfortable delusion.,Edward Abbey,       truth
2326,Everything must be made as simple as possible. But not simpler.,Albert Einstein,"       einstein,       paraphrased,       science,       systems"
2327,"Life is too short to waste any amount of time on wondering what other people think about you. In the first place, if they had better things going on in their lives, they wouldn't have the time to sit around and talk about you. What's important to me is not others' opinions of me, but what's important to me is my opinion of myself.",C. JoyBell C.,"       defiant,       freedom,       inspirational,       inspirational-attitude,       inspirational-quotes,       inspiring,       life-and-living,       self-belief,       self-love,       self-worth,       society"
2328,"Whatever you are physically...male or female, strong or weak, ill or healthy--all those things matter less than what your heart contains. If you have the soul of a warrior, you are a warrior. All those other things, they are the glass that contains the lamp, but you are the light inside.","Cassandra Clare,","       character,       clockwork-angel,       jem-carstairs,       lamp,       light,       soul,       warrior"
2329,"I hate to advocate drugs, alcohol, violence, or insanity to anyone, but they've always worked for me.",Hunter S. Thompson,
2330,"Anyone can hide. Facing up to things, working through them, that's what makes you strong.",Sarah Dessen,"       inspirational,       strength,       tough-times"
2331,It is one of life's bitterest truths that bedtime so often arrives just when things are really getting interesting.,"Lemony Snicket,",
2332,Nothing great in the world was accomplished without passion.,Georg Wilhelm Friedrich Hegel,
2333,The only thing better than imagining Dimitri carrying me in his arms was imagining him shirtless while carrying me in his arms.,"Richelle Mead,","       academy,       mead,       richelle,       vampire"
2334,To choose doubt as a philosophy of life is akin to choosing immobility as a means of transportation.,"Yann Martel,",       life
2335,"The Very first moment I beheld him, my heart was irrevocably gone.","Jane Austen,",       romance
2336,"...and then, I have nature and art and poetry, and if that is not enough, what is enough?",Vincent Willem van Gogh,"       art,       nature,       poetry,       suicide"
2337,"Remember me and smile, for it's better to forget than to remember me and cry.",Dr. Seuss,"       dr-seuss,       goodbye"
2338,Education: the path from cocky ignorance to miserable uncertainty.,Mark Twain,       education
